{
  "config_errors": [],
  "decisions": [
    {
      "canonical_gap_id": "gap:dedf923a13a00573",
      "decision": "acknowledged",
      "evidence": {
        "assertion_shape": "assert_eq!(discounted_total(/* boundary input where amount == discount_threshold */), /* expected */)",
        "candidate_values": [
          "amount == discount_threshold"
        ],
        "configured_off": false,
        "missing_discriminator": "amount == discount_threshold",
        "mutation_calibration": {
          "available": false,
          "confidence_effect": "not_used",
          "outcome": null
        },
        "nearby_test_changed": false,
        "recommendation_calibration": {
          "available": false,
          "confidence_effect": "not_used",
          "outcome": null
        },
        "recommended_test": "tests/pricing.rs::above_threshold_gets_discount",
        "suppressed": false
      },
      "gap_state": "actionable",
      "gate_reason": "policy-eligible gap acknowledged by ripr-waive",
      "id": "ripr-gate-gap-dedf923a13a00573",
      "placement": {
        "line": 88,
        "path": "src/pricing.rs"
      },
      "policy": {
        "acknowledgement_label": "ripr-waive",
        "baseline_identity": "gap:dedf923a13a00573",
        "mode": "acknowledgeable",
        "threshold": "high_confidence_new_gap"
      },
      "repair_route": {
        "analysis_outcome_command": "ripr check --root . --base main --mode draft --format json > <cwd>/target/ripr/workflow/analysis-outcome.json",
        "authority_boundary": "static_ripr_evidence_only",
        "canonical_gap_id": "gap:dedf923a13a00573",
        "changed_behavior": "amount >= discount_threshold",
        "changed_owner": "pricing::discounted_total",
        "classification": "weakly_gripped",
        "inspection_command": "ripr agent brief --root . --seam-id 8f7fa8644fd12280 --json > <cwd>/target/ripr/workflow/agent-brief.json",
        "limitation": null,
        "missing_discriminator": "amount == discount_threshold",
        "receipt_command": "ripr agent receipt --root . --verify-json target/ripr/workflow/agent-verify.json --seam-id 8f7fa8644fd12280 --json --out target/ripr/reports/agent-receipt.json",
        "repair_command": "ripr agent repair --root . --seam-id 8f7fa8644fd12280 --phase before",
        "repair_target": {
          "file": "tests/pricing.rs",
          "kind": "related_test",
          "line": 12,
          "name": "above_threshold_gets_discount"
        },
        "seam_id": "8f7fa8644fd12280",
        "test_intent": "Write one focused Rust test for amount == discount_threshold. Place it in tests/pricing.rs near above_threshold_gets_discount. Do not change production code. Preserve existing fixture style. Verify with ripr agent verify.",
        "verify_command": "ripr agent verify --root . --before target/ripr/workflow/before.repo-exposure.json --after target/ripr/workflow/after.repo-exposure.json --json > <cwd>/target/ripr/workflow/agent-verify.json"
      },
      "seam_id": "8f7fa8644fd12280",
      "severity": "warning",
      "source": "pr_guidance",
      "source_id": "ripr-review-8f7fa8644fd12280",
      "static_class": "weakly_gripped"
    }
  ],
  "inputs": {
    "agent_receipt": null,
    "agent_verify": null,
    "baseline": null,
    "labels": [
      "ripr-waive"
    ],
    "labels_json": "fixtures/boundary_gap/expected/calibrated-gate/acknowledged-waiver/labels.json",
    "mutation_calibration": null,
    "pr_guidance": "fixtures/boundary_gap/expected/pr-guidance/exact-line/comments.json",
    "recommendation_calibration": null,
    "repo_exposure": null,
    "sarif_policy": null
  },
  "limits_note": "Optional policy over static RIPR evidence; advisory by default; runtime mutation calibration is used only when supplied.",
  "mode": "acknowledgeable",
  "new_unsuppressed": {
    "basis": "diff",
    "count": 0,
    "reason": null
  },
  "policy": {
    "acknowledgement_labels": [
      "ripr-waive"
    ],
    "default_workflow_posture": "advisory",
    "mode": "acknowledgeable",
    "threshold": "high_confidence_new_gap"
  },
  "root": ".",
  "schema_version": "0.1",
  "status": "acknowledged",
  "subject": {
    "analyzer_version": "0.0.0+pinned-golden-analyzer-version",
    "inputs": {
      "labels_json": {
        "content_hash": "sha256:f9cb8507e17ca5b3907c2c69e92d62e36de3b98326f028157c368dd32ae09892"
      },
      "pr_guidance": {
        "content_hash": "sha256:9ba7e23ea2aab45403f8f38327d0196fb309b671b6f78b612f753902cd59bf7a"
      }
    },
    "labels_sha256": "sha256:95245a3bb93d41769162996af69a9b719b1a09c7d42ab846c780306375c2e070"
  },
  "summary": {
    "acknowledged": 1,
    "advisory": 0,
    "blocking": 0,
    "evaluated": 1,
    "not_applicable": 0,
    "suppressed": 0,
    "unknown_confidence": 0
  },
  "tool": "ripr",
  "warnings": []
}